{
  "$schema": "schemas/pack-v1.schema.json",
  "name": "model-catalog",
  "schema_version": 1,
  "tag": "data-model-catalog-v0.5.16",
  "generated_at": "2026-10-28",
  "description": "Model economics catalog. v0.5.16: adds OpenAI GPT-6.1 Terra with Artificial Analysis Intelligence Index v5.0 and Terminal-Bench 4.0 readings for Terra and GPT-6.1 Sol; records Gemini 4 Carbon's announcement without a row; sets two Gemini 3 Flash ids to historical; adds the DeepSeek-V4.1-Flash-1017 alias. v0.5.15: adds Google Gemini 4 Argon (generally available 2026-10-13; API introductory price $2 / $0.10 / $10 per M tokens through 2026-11-30, then $4 / $0.20 / $20) with Google's launch table and model card, Artificial Analysis, Vals, Arena, Epoch and OpenRouter readings. Boards run it at high effort only. Google and the boards disagree on several scores; both are stored.",
  "files": [
    "CHANGELOG.md",
    "FRESHNESS.md",
    "SCHEMA.md",
    "SOURCES.json",
    "capabilities/effort-surfaces-2026-07.json",
    "charts/cost-vs-intelligence-all-dark.svg",
    "charts/cost-vs-intelligence-all-light.svg",
    "charts/cost-vs-intelligence-dark.svg",
    "charts/cost-vs-intelligence-light.svg",
    "charts/effort-curves-dark.svg",
    "charts/effort-curves-light.svg",
    "charts/option-map-dark.svg",
    "charts/option-map-light.svg",
    "charts/social-card.png",
    "digitized/README.md",
    "digitized/anthropic-opus5-frontier-bench-effort.json",
    "digitized/anthropic-opus5-gdpval-effort.json",
    "digitized/anthropic-opus5-misaligned-behavior.json",
    "digitized/anthropic-sonnet5-benchmark-table.json",
    "digitized/anthropic-sonnet5-browsecomp-effort.json",
    "digitized/anthropic-sonnet5-firefox147-exploit.json",
    "digitized/anthropic-sonnet5-misaligned-behavior.json",
    "digitized/anthropic-sonnet5-osworld-effort.json",
    "digitized/assets/anthropic-opus5-frontier-bench-effort.png",
    "digitized/assets/anthropic-opus5-gdpval-effort.png",
    "digitized/assets/anthropic-opus5-misaligned-behavior.png",
    "digitized/assets/anthropic-sonnet5-benchmark-table.png",
    "digitized/assets/anthropic-sonnet5-browsecomp-effort.png",
    "digitized/assets/anthropic-sonnet5-firefox147-exploit.png",
    "digitized/assets/anthropic-sonnet5-misaligned-behavior.png",
    "digitized/assets/anthropic-sonnet5-osworld-effort.png",
    "guide.json",
    "metrics.json",
    "models.json",
    "performance/alibaba-qwen-2026-07.json",
    "performance/anthropic-effort-quality-2026-07.json",
    "performance/anthropic-fable-mythos-5-1-2026-09.json",
    "performance/anthropic-haiku-5-5-launch-2026-10.json",
    "performance/anthropic-haiku-5-5-system-card-2026-10.json",
    "performance/anthropic-haiku5-5-digitized-2026-10.json",
    "performance/anthropic-opus-5-5-launch-2026-09.json",
    "performance/anthropic-opus-5-5-system-card-2026-09.json",
    "performance/anthropic-opus5-5-digitized-2026-09.json",
    "performance/anthropic-opus5-digitized-2026-07.json",
    "performance/anthropic-sonnet-5-5-launch-2026-09.json",
    "performance/anthropic-sonnet-5-5-system-card-2026-09.json",
    "performance/anthropic-sonnet5-5-digitized-2026-09.json",
    "performance/anthropic-sonnet5-digitized-2026-07.json",
    "performance/arcprize-aa-gpt-6-astra-2026-09.json",
    "performance/arcprize-full-roster-2026-09-22.json",
    "performance/arcprize-gpt-5-6-2026-07.json",
    "performance/arcprize-gpt-6-sol-luna-2026-09.json",
    "performance/arcprize-leaderboard-2026-10-07.json",
    "performance/arena-gemini-4-argon-2026-10-13.json",
    "performance/arena-text-2026-10-07.json",
    "performance/artificial-analysis-2026-07.json",
    "performance/artificial-analysis-claude-haiku-5-5-2026-10-07.json",
    "performance/artificial-analysis-claude-sonnet-5-5-2026-09-28.json",
    "performance/artificial-analysis-coding-agents-gemini-4-argon-2026-10-13.json",
    "performance/artificial-analysis-coding-agents-muse-wonder-2026-10-13.json",
    "performance/artificial-analysis-full-roster-2026-09-22.json",
    "performance/artificial-analysis-gemini-4-argon-2026-10-13.json",
    "performance/artificial-analysis-gpt-6-1-sol-2026-09-29.json",
    "performance/artificial-analysis-gpt-6-sol-luna-2026-09.json",
    "performance/artificial-analysis-intelligence-index-2026-09.json",
    "performance/artificial-analysis-intelligence-index-opus-5-5-2026-09.json",
    "performance/artificial-analysis-intelligence-index-v5-2026-10-28.json",
    "performance/artificial-analysis-leaderboard-2026-10-07.json",
    "performance/artificial-analysis-muse-wonder-2026-10-13.json",
    "performance/artificial-analysis-openweight-frontier-2026-09-23.json",
    "performance/artificialanalysis-opus5-briefcase-2026-09.json",
    "performance/browsecomp-2026-07.json",
    "performance/deepswe-digitized-full-roster-2026-09-22.json",
    "performance/deepswe-leaderboard-2026-09.json",
    "performance/deepswe-leaderboard-gpt-5-6-2026-08.json",
    "performance/epoch-ai-gemini-4-argon-2026-10-13.json",
    "performance/epoch-ai-model-pages-2026-09.json",
    "performance/epoch-ai-model-pages-2026-10-07.json",
    "performance/epoch-ai-muse-wonder-2026-10-13.json",
    "performance/frontier-gap-notes-2026-09-29.json",
    "performance/frontier-gap-notes-2026-10-07.json",
    "performance/gemini-4-argon-board-coverage-2026-10-13.json",
    "performance/google-gemini-4-argon-launch-2026-10-13.json",
    "performance/google-gemini-4-argon-model-card-2026-10-13.json",
    "performance/google-gemini-launch-tables-2026-09.json",
    "performance/google-xai-board-snapshot-2026-09-23.json",
    "performance/gpt-6-1-sol-board-coverage-2026-09-29.json",
    "performance/gpt-6-1-sol-board-coverage-2026-10-07.json",
    "performance/gpt-6-sol-luna-board-coverage-2026-09-22.json",
    "performance/haiku-5-5-board-coverage-2026-10-07.json",
    "performance/lmarena-text-2026-07.json",
    "performance/local-evals-2026-07.json",
    "performance/meta-muse-wonder-launch-2026-10-12.json",
    "performance/meta-muse-wonder-model-card-2026-10-12.json",
    "performance/muse-wonder-board-coverage-2026-10-13.json",
    "performance/openai-gpt-5-6-launch-2026-07.json",
    "performance/openai-gpt-5-6-launch-svg-2026-09.json",
    "performance/openai-gpt-6-1-sol-launch-2026-09.json",
    "performance/openai-gpt-6-1-sol-system-card-2026-09.json",
    "performance/openai-gpt-6-astra-launch-2026-09.json",
    "performance/openai-gpt-6-astra-system-card-2026-09.json",
    "performance/openai-gpt-6-sol-luna-launch-2026-09.json",
    "performance/openai-gpt-6-sol-luna-launch-curves-2026-09.json",
    "performance/openai-quality-2026-07.json",
    "performance/openrouter-gemini-4-argon-2026-10-13.json",
    "performance/openrouter-gpt-6-sol-luna-2026-09.json",
    "performance/openrouter-muse-wonder-2026-10-13.json",
    "performance/openweight-vendor-frontier-2026-09-23.json",
    "performance/opus-5-5-board-coverage-2026-09-22.json",
    "performance/sonnet-5-5-board-coverage-2026-09-28.json",
    "performance/swe-bench-2026-07.json",
    "performance/swe-marathon-muse-wonder-2026-10-13.json",
    "performance/tbench-ai-official-2026-10-07.json",
    "performance/tbench-ai-official-full-roster-2026-09-22.json",
    "performance/terminal-bench-2-1-2026-09.json",
    "performance/terminal-bench-2026-07.json",
    "performance/terminal-bench-4-astra-audit-2026-09.json",
    "performance/terminal-bench-4-vals-opus-5-5-2026-09.json",
    "performance/third-party-board-roster-refresh-2026-10-07.json",
    "performance/vals-ai-claude-sonnet-5-5-2026-09-28.json",
    "performance/vals-ai-full-roster-2026-09-22.json",
    "performance/vals-ai-gemini-4-argon-2026-10-13.json",
    "performance/vals-ai-index-finance-agent-2026-10-06.json",
    "performance/vals-ai-muse-wonder-2026-10-13.json",
    "performance/vals-ai-openweight-frontier-2026-09-23.json",
    "performance/vals-ai-terminal-bench-4-2026-10-06.json",
    "performance/xai-grok-4-7-launch-2026-09.json",
    "pricing/alibaba-api-2026-07.json",
    "pricing/anthropic-api-2026-07.json",
    "pricing/codex-credits-2026-07.json",
    "pricing/deepseek-api-2026-09.json",
    "pricing/google-api-2026-07.json",
    "pricing/meta-api-2026-10.json",
    "pricing/minimax-api-2026-09.json",
    "pricing/mistral-api-2026-09.json",
    "pricing/moonshot-api-2026-09.json",
    "pricing/openai-api-2026-07.json",
    "pricing/openrouter-openweight-frontier-2026-09-23.json",
    "pricing/stepfun-api-2026-10.json",
    "pricing/xai-api-2026-07.json",
    "pricing/xiaomi-api-2026-09.json",
    "pricing/zai-glm-api-2026-09.json",
    "schemas/README.md",
    "schemas/capabilities-v1.schema.json",
    "schemas/guide-v1.schema.json",
    "schemas/models-v1.schema.json",
    "schemas/pack-v1.schema.json",
    "schemas/performance-v1.schema.json",
    "schemas/pricing-v1.schema.json",
    "schemas/sources-v1.schema.json"
  ],
  "schemas": {
    "pricing": "schemas/pricing-v1.schema.json",
    "performance": "schemas/performance-v1.schema.json",
    "capabilities": "schemas/capabilities-v1.schema.json",
    "models": "schemas/models-v1.schema.json",
    "sources": "schemas/sources-v1.schema.json",
    "pack": "schemas/pack-v1.schema.json",
    "guide": "schemas/guide-v1.schema.json"
  },
  "related": {
    "policy": "data-model-choice-policy-v0.1.4",
    "openai_gpt_5_6": "https://openai.com/index/gpt-5-6/",
    "arcprize": "https://arcprize.org/results/openai-gpt-5-6",
    "terminal_bench": "https://www.tbench.ai/leaderboard/terminal-bench/2.1",
    "local_evals": "data-local-evals-v0.1.1",
    "deepswe_leaderboard": "https://deepswe.datacurve.ai/",
    "research_note": "https://github.com/tnunamak/dotfiles/blob/main/ai/research/model-routing/gpt-5-6-luna-at-max-effort-is-a-defensible-not-dominant-codex-value-pick.md"
  }
}
