{
 "$schema": "schemas/pack-v1.schema.json",
 "name": "decision-model-catalog",
 "schema_version": 1,
 "tag": "data-decision-model-catalog-v0.1.1",
 "generated_at": "2026-10-07",
 "description": "Decision-model catalog: source-backed, nuance-preserving data on typed decision models for an agent hot path (TypeSafe Jev, Cloudflare Clef/Clef-flash, OpenAI Decisions, Perplexity decider, open entrants). v0.1.0, first release (as of 2026-10-07): 132 models (all 111 Jev Decision Index 0.3 entrants + hosted APIs), 285 metrics (one per benchmark x publisher/harness; latency per vantage), 25 performance docs / 7964 score rows with measurement context, 9 pricing docs (raw units + sourced conversions), 6 capability docs, 56 caveats with verbatim evidence, 92 sources. Vendor-run and board numbers are tagged; scores compare only within a metric_id. v0.1.1 (2026-10-11): data corrections; Span-01 Lite and Clef Flash price lookups reach their own rows, quota-truncated AG News rows are not comparable, and local CPU latency rows record their real sampling and prefix-cache state.",
 "files": [
  "CHANGELOG.md",
  "FRESHNESS.md",
  "README.md",
  "SCHEMA.md",
  "SOURCES.json",
  "capabilities/cloudflare-clef-capabilities-2026-10.json",
  "capabilities/open-weight-self-host-capabilities-2026-10.json",
  "capabilities/openai-decisions-capabilities-2026-10.json",
  "capabilities/other-hosted-decision-apis-capabilities-2026-10.json",
  "capabilities/perplexity-decider-capabilities-2026-10.json",
  "capabilities/typesafe-jev-capabilities-2026-10.json",
  "caveats.json",
  "evidence/local-decider-cpu-bench/bench_basic.py",
  "evidence/local-decider-cpu-bench/bench_decider.py",
  "evidence/local-decider-cpu-bench/bench_server.py",
  "evidence/local-decider-cpu-bench/bench_server_prime.py",
  "evidence/local-decider-cpu-bench/r_2b_q8_server.json",
  "evidence/local-decider-cpu-bench/r_2b_q8_server_prime.json",
  "evidence/local-decider-cpu-bench/r_2b_q8_t12.json",
  "evidence/local-decider-cpu-bench/r_2b_q8_t8.json",
  "evidence/local-decider-cpu-bench/r_4b_q4_t8.json",
  "evidence/local-decider-cpu-bench/r_basic.jsonl.txt",
  "metrics.json",
  "models.json",
  "performance/arxiv-2609-24574-css-annotation-2026-09.json",
  "performance/arxiv-2609-27678-legal-2026-09.json",
  "performance/arxiv-2609-37647-bonn-jev-2026-09.json",
  "performance/arxiv-2610-00346-decision-gates-2026-10.json",
  "performance/cloudflare-clef-launch-2026-10-01.json",
  "performance/devto-clef-flash-vs-jev-2026-10-01.json",
  "performance/hard-decisions-proofwriter-2026-10-03.json",
  "performance/jev-decision-index-0-3-headline-2026-10-06.json",
  "performance/jev-decision-index-0-3-latency-2026-10-06.json",
  "performance/jev-decision-index-0-3-per-benchmark-2026-10-06.json",
  "performance/jevbench-v1-6-1-2026-10-06.json",
  "performance/local-decider-cpu-measurements-2026-10-03.json",
  "performance/localllama-typed-decisions-card-2026-10-01.json",
  "performance/morrenhale-jev-laya-julia-2026-09-27.json",
  "performance/nicia-admission-decision-eval-2026-10-01.json",
  "performance/openai-decisions-claims-2026-10-07.json",
  "performance/openrouter-decision-models-2026-10-06.json",
  "performance/perplexity-model-cards-2026-10.json",
  "performance/reddit-jev-fanout-scaling-2026-10-04.json",
  "performance/requesty-decision-benchmark-2026-10-05.json",
  "performance/s1mb-system-one-mosaic-2026-09-30.json",
  "performance/skill-siujev-cross-vendor-evals-2026-10-01.json",
  "performance/streamdecisionbench-2026-10-06.json",
  "performance/typesafe-evals-2026-10-06.json",
  "performance/typesafe-launch-claims-2026-09-15.json",
  "pricing/cloudflare-workers-ai-2026-10.json",
  "pricing/liquid-ai-api-2026-10.json",
  "pricing/openai-decisions-api-2026-10.json",
  "pricing/openrouter-decisions-2026-10.json",
  "pricing/perplexity-api-2026-10.json",
  "pricing/requesty-router-2026-10.json",
  "pricing/self-hosted-open-weights-2026-10.json",
  "pricing/sference-eu-2026-10.json",
  "pricing/typesafe-api-2026-10.json",
  "schemas/README.md",
  "schemas/capabilities-v1.schema.json",
  "schemas/caveats-v1.schema.json",
  "schemas/metrics-v1.schema.json",
  "schemas/models-v1.schema.json",
  "schemas/pack-v1.schema.json",
  "schemas/performance-v1.schema.json",
  "schemas/pricing-v1.schema.json",
  "schemas/sources-v1.schema.json"
 ],
 "schemas": {
  "pricing": "schemas/pricing-v1.schema.json",
  "performance": "schemas/performance-v1.schema.json",
  "capabilities": "schemas/capabilities-v1.schema.json",
  "models": "schemas/models-v1.schema.json",
  "metrics": "schemas/metrics-v1.schema.json",
  "caveats": "schemas/caveats-v1.schema.json",
  "sources": "schemas/sources-v1.schema.json",
  "pack": "schemas/pack-v1.schema.json"
 },
 "related": {
  "baseline": "https://github.com/tnunamak/minnows/tree/main/data/model-catalog"
 }
}
