{
  "name": "local-evals",
  "schema_version": 1,
  "tag": "data-local-evals-v0.1.3",
  "generated_at": "2026-10-11",
  "description": "Harness SMOKE tests for policy-op runner wiring only — NOT model quality evidence. v0.1.1 reclassified the v0.1.0 historical waspflow rows as grade D / smoke after the Sol+Fable audit. v0.1.2 changes wording only (runner no longer named waspflow); data is unchanged. v0.1.3 corrects SCHEMA.md to name the smoke rows' evidence grade (D); data is unchanged.",
  "files": [
    "README.md",
    "SCHEMA.md",
    "tasks/implement-standard-oracle-v1.json",
    "tasks/fanout-explore-oracle-v1.json",
    "tasks/review-audit-oracle-v1.json",
    "fixtures/mini-implement/calc.py",
    "fixtures/mini-implement/test_calc.py",
    "fixtures/mini-implement/README.md",
    "fixtures/mini-review/auth.py",
    "fixtures/mini-review/README.md",
    "fixtures/mini-explore/src/colors.py",
    "fixtures/mini-explore/src/shapes.py",
    "fixtures/mini-explore/src/util.py",
    "fixtures/mini-explore/README.md",
    "results/2026-07-09-implement-standard-oracle-v1-claude-sonnet-5-medium.json",
    "results/2026-07-09-fanout-explore-oracle-v1-claude-sonnet-5-medium.json",
    "results/2026-07-09-review-audit-oracle-v1-gpt-5.5-xhigh.json"
  ],
  "related": {
    "catalog": "data-model-catalog-v0.5.2",
    "policy": "data-model-choice-policy-v0.1.4"
  }
}
